{
  "id": "manage-supabase-environments",
  "version": "1.0.0",
  "owner": "pacify-x-skill-catalogue",
  "status": "active",
  "provenance": {
    "type": "catalogue_projection",
    "basis": [
      "registry/skill_catalog.toml",
      "registry/admission_ledger.json",
      "registry/skill_packages/manage-supabase-environments.json",
      ".px/skills/manage-supabase-environments/SKILL.md"
    ],
    "admission_record": "manage-supabase-environments"
  },
  "hash": "b21d35ea36626978fa9f336a8920d2b54918a00fb691415e6f0633c0547adcd3",
  "license": "Apache-2.0",
  "provides": [
    "environment-isolation",
    "preview",
    "project-ref",
    "staging",
    "supabase"
  ],
  "consumes": [
    "task context",
    "registry state"
  ],
  "effects": [
    "read_local"
  ],
  "permissions": [
    "read_local"
  ],
  "dependencies": [],
  "conflicts": [],
  "cost": {
    "class": "bounded",
    "max_tool_calls": 0,
    "currency": "local"
  },
  "latency": {
    "class": "local",
    "max_seconds": 30,
    "basis": "bounded"
  },
  "risk": "R1",
  "validation": {
    "suite": "tests/test_service_capability_provider.py",
    "status": "declared",
    "covers": [
      "environment-isolation",
      "preview",
      "project-ref",
      "staging",
      "supabase"
    ]
  },
  "evidence": {
    "anchor": "registry/skill_packages/manage-supabase-environments.json",
    "kind": "skill_package"
  },
  "approval": {
    "required": false,
    "authority": "skill-admission-controller"
  },
  "rollback": {
    "required": false,
    "basis": "catalogue_reprojection"
  }
}
