{
  "id": "discover-environment-safely",
  "version": "0.1.0",
  "owner": "pacify-x-skill-catalogue",
  "status": "active",
  "provenance": {
    "type": "catalogue_projection",
    "basis": [
      "registry/skill_catalog.toml",
      "registry/admission_ledger.json",
      "registry/skill_packages/discover-environment-safely.json",
      ".px/skills/discover-environment-safely/SKILL.md"
    ],
    "admission_record": "discover-environment-safely"
  },
  "hash": "644dedd54ed02b4838b3cf4b30ac68dfadeb9994ab5d35c70289dc772cfc03b8",
  "license": "Apache-2.0",
  "provides": [
    "bootstrap",
    "discovery",
    "environment",
    "tools"
  ],
  "consumes": [
    "task context",
    "registry state"
  ],
  "effects": [
    "read_local"
  ],
  "permissions": [
    "read_local"
  ],
  "dependencies": [],
  "conflicts": [],
  "cost": {
    "class": "bounded",
    "max_tool_calls": 0,
    "currency": "local"
  },
  "latency": {
    "class": "local",
    "max_seconds": 30,
    "basis": "bounded"
  },
  "risk": "R1",
  "validation": {
    "suite": "tests/test_assurance_controls.py",
    "status": "declared",
    "covers": [
      "bootstrap",
      "discovery",
      "environment",
      "tools"
    ]
  },
  "evidence": {
    "anchor": "registry/skill_packages/discover-environment-safely.json",
    "kind": "skill_package"
  },
  "approval": {
    "required": false,
    "authority": "skill-admission-controller"
  },
  "rollback": {
    "required": false,
    "basis": "catalogue_reprojection"
  }
}
