{
  "id": "self-host-supabase",
  "version": "1.0.0",
  "owner": "pacify-x-skill-catalogue",
  "status": "active",
  "provenance": {
    "type": "catalogue_projection",
    "basis": [
      "registry/skill_catalog.toml",
      "registry/admission_ledger.json",
      "registry/skill_packages/self-host-supabase.json",
      ".px/skills/self-host-supabase/SKILL.md"
    ],
    "admission_record": "self-host-supabase"
  },
  "hash": "79a491ced530a5cfb9760b7b310281f7a0f47865623148a0a73e4135b6cf0d14",
  "license": "Apache-2.0",
  "provides": [
    "docker",
    "operations",
    "secrets",
    "self-hosting",
    "supabase"
  ],
  "consumes": [
    "task context",
    "registry state"
  ],
  "effects": [
    "network",
    "read_local"
  ],
  "permissions": [
    "network",
    "read_local"
  ],
  "dependencies": [],
  "conflicts": [],
  "cost": {
    "class": "bounded",
    "max_tool_calls": 0,
    "currency": "local"
  },
  "latency": {
    "class": "local",
    "max_seconds": 30,
    "basis": "bounded"
  },
  "risk": "R1",
  "validation": {
    "suite": "tests/test_service_capability_provider.py",
    "status": "declared",
    "covers": [
      "docker",
      "operations",
      "secrets",
      "self-hosting",
      "supabase"
    ]
  },
  "evidence": {
    "anchor": "registry/skill_packages/self-host-supabase.json",
    "kind": "skill_package"
  },
  "approval": {
    "required": false,
    "authority": "skill-admission-controller"
  },
  "rollback": {
    "required": false,
    "basis": "catalogue_reprojection"
  }
}
