{
  "id": "supervise-contained-execution",
  "version": "0.1.0",
  "owner": "pacify-x-skill-catalogue",
  "status": "active",
  "provenance": {
    "type": "catalogue_projection",
    "basis": [
      "registry/skill_catalog.toml",
      "registry/admission_ledger.json",
      "registry/skill_packages/supervise-contained-execution.json",
      ".px/skills/supervise-contained-execution/SKILL.md"
    ],
    "admission_record": "supervise-contained-execution"
  },
  "hash": "7dbb59f93b758bf0f07999a8a64930d493c9952ff6bfe25745698a2f15184c95",
  "license": "Apache-2.0",
  "provides": [
    "containment",
    "authorization",
    "scope",
    "safety"
  ],
  "consumes": [
    "task context",
    "registry state"
  ],
  "effects": [
    "read_local"
  ],
  "permissions": [
    "read_local"
  ],
  "dependencies": [],
  "conflicts": [],
  "cost": {
    "class": "bounded",
    "max_tool_calls": 0,
    "currency": "local"
  },
  "latency": {
    "class": "local",
    "max_seconds": 30,
    "basis": "bounded"
  },
  "risk": "R1",
  "validation": {
    "suite": "tests/test_assurance_controls.py",
    "status": "declared",
    "covers": [
      "containment",
      "authorization",
      "scope",
      "safety"
    ]
  },
  "evidence": {
    "anchor": "registry/skill_packages/supervise-contained-execution.json",
    "kind": "skill_package"
  },
  "approval": {
    "required": false,
    "authority": "skill-admission-controller"
  },
  "rollback": {
    "required": false,
    "basis": "catalogue_reprojection"
  }
}
